レンジャー,大防御,行動,－,－,－,自身,－,－,次の手番まで火・水以外の全ての耐性を得て防御状態になる。
レンジャー,火柱,行動,特殊,－,遠隔,敵単,火,５Ｄ,敵単体に火属性攻撃。物理か呪文かは任意で行使できる。
レンジャー,守りの霧,行動,－,－,－,自身,－,－,１回だけ、敵の攻撃を無条件で回避する。
レンジャー,ステルス,行動,呪文,３,－,特殊,－,－,戦闘時は３ターンの間、単体の対象として選ばれなくなる。非戦闘時はトヘロスの効果。
レンジャー,オオカミアタック,行動,物理,１６,遠隔,敵単,物,10Ｄ,敵単体をランダムに２回物理攻撃する。
魔物使い,魔物の心・下,常時,－,－,－,自身,－,－,魔物特技の基礎特技を選んで習得できる。選んだ魔物特技ごとに別特技として扱う。
魔物使い,魔物の声,常時,－,－,－,自身,－,－,あなたは言葉を話せない魔物とも意思疎通できる。
魔物使い,見逃す,行動,－,－,遠隔,敵全,－,－,自分よりレベルの低いモンスターを見逃す。経験値は手に入らないがゴールドは手に入る。
魔物使い,宥める,行動,物理,２,遠隔,敵単,－,－,対象を切々と宥めて、３ターンの間魔法攻撃力を「術者のレベル」点減少させる。
魔物使い,魔物の心・上,常時,－,－,－,自身,－,－,魔物特技の皆伝特技を選んで習得できる。選んだ魔物特技ごとに別特技として扱う。
魔物使い,吐息返し,行動,－,４,－,自身,－,－,戦闘中、息系の攻撃を反射するようになる。
魔物使い,魔物の友,常時,－,－,－,自身,－,－,貴方は１匹だけ、倒した魔物の中で自分のレベルより低い魔物を仲間にできる。
魔物使い,地這い大蛇,行動,武器,１６,遠隔,敵列,土,10Ｄ,敵１列に土属性物理攻撃。
怪盗,花吹雪,行動,物理,２,遠隔,敵列,風,－,敵１列の命中と回避を－１する。
怪盗,波紋演舞,行動,武器,－,近接,敵単,物,２Ｄ,水棲系には防御力半分。
怪盗,ハートブレイク,行動,武器,２,近接,敵単,物,２Ｄ,１Ｄ６偶数で行動不能付加。
怪盗,魔封じの月,行動,呪文,３,遠隔,敵単,－,－,対象を魔封状態にする。
怪盗,トリックハント,行動,武器,－,近接,敵単,物,－,対象から１Ｄ６偶数でアイテムを盗み、奇数なら行動不能にする。
怪盗,風姿家伝,行動,－,３,－,自身,－,－,１回だけ攻撃を確実に回避できる。
怪盗,ゴールドハンマー,行動,武器,２,近接,敵単,物,３Ｄ,敵単体に物理攻撃し、さらに「威力ダイス＋使用者のレベル」に等しいゴールドを得る。
怪盗,タナトスハント,行動,武器,３,近接,敵単,物,２Ｄ,対象がなんらかの状態異常の場合、防御力半分。
怪盗,祝福の月,行動,呪文,２,近接,味単,－,３Ｄ,対象のＨＰを回復する。
怪盗,復活の月,行動,呪文,８,近接,味単,－,－,味方単体をＨＰ半分で復活させる。ただし１Ｄ６で１が出たら失敗する。
怪盗,ミラクルムーン,行動,武器,１６,遠隔,敵全,物,７Ｄ,敵全体に物理攻撃。また味方全体のＨＰを「威力」点回復させる。
スーパースター,サインぜめ,行動,物理,５０Ｇ,遠隔,敵単,物,３Ｄ,威力に＋レベルした物理攻撃を行う。特技の命中とダメージの基準がうつくしさとなる。
スーパースター,スキャンダル,行動,物理,４,遠隔,敵全,－,－,３ターンの間、対象の命中判定を－２する。この特技の命中はうつくしさ基準で行う。
スーパースター,メイクアップ,行動,－,３,－,自身,－,－,うつくしさを基準とした判定に＋１Ｄ６の修正を３ターンの間得る。
スーパースター,スポットライト,行動,－,６,－,自身,－,－,次の自分の手番まで、単体攻撃の対象を全て自分にする。
スーパースター,メガザルダンス,行動,呪文,－,遠隔,味全,－,－,味方全員を蘇生して全回復させる代わり、貴方は死亡状態となる。
スーパースター,ハッスルダンス,行動,呪文,－,遠隔,味全,－,４Ｄ,味方全員のＨＰを回復する。
スーパースター,ムーンサルト,行動,物理,－,遠隔,敵全,物,４Ｄ,敵全員に物理攻撃、特技の命中とダメージの基準がうつくしさとなる。
スーパースター,精霊の歌,行動,呪文,－,遠隔,味全,－,－,ターン終了時に死亡状態のキャラは１Ｄ６を振り、２以下が出なければＨＰ半分で復活できる。
スーパースター,バックダンサー呼び,行動,物理,１５,遠隔,敵全,物,５Ｄ,敵全体に防御半減物理攻撃、命中とダメージの基準がうつくしさとなる。ただしメタル系には無効。
スーパースター,ゴールドシャワー,行動,物理,特殊,遠隔,敵全,物,特殊,２００ゴールド単位で任意のゴールドを消費し、威力「消費ゴールド÷１００」Ｄの防御半減物理攻撃を行う。
